{
  "$schema": "https://json-schema.org/draft/2020-12/schema",
  "$id": "urn:ethos:schema:sandbox-subprocess-contract:1",
  "title": "Ethos sandbox_subprocess v1 contract inventory",
  "description": "Contract inventory for the future sandbox_subprocess v1 backend contract. This validates inventory shape and vocabulary; executable behavior remains on the existing PDF worker-process carrier until sandbox hardening is explicitly added.",
  "type": "object",
  "required": [
    "schema_version",
    "contract",
    "status",
    "carrier",
    "cases",
    "artifact_header_cases",
    "pipe_limit_cases",
    "error_envelope_cases",
    "diagnostic_cases",
    "explicit_blockers"
  ],
  "additionalProperties": false,
  "properties": {
    "schema_version": { "const": 1 },
    "contract": { "const": "sandbox_subprocess.v1" },
    "status": { "const": "supported" },
    "carrier": { "const": "pdfium worker process" },
    "cases": {
      "type": "array",
      "minItems": 1,
      "items": {
        "type": "object",
        "required": [
          "name",
          "command_surface",
          "request",
          "test_filter",
          "boundary",
          "expected_failure"
        ],
        "additionalProperties": false,
        "properties": {
          "name": { "$ref": "#/$defs/case_name" },
          "command_surface": {
            "enum": ["ethos doc parse", "ethos fingerprint"]
          },
          "request": { "$ref": "#/$defs/repo_path" },
          "test_filter": { "$ref": "#/$defs/rust_test_filter" },
          "boundary": {
            "enum": [
              "max_parse_ms_timeout",
              "memory_limit_error",
              "stable_error_envelope",
              "diagnostics_gated_stderr"
            ]
          },
          "expected_failure": {
            "type": "object",
            "required": [
              "exit_code",
              "error_code",
              "error_message",
              "stdout",
              "diagnostics"
            ],
            "additionalProperties": false,
            "properties": {
              "exit_code": { "type": "integer", "minimum": 1 },
              "error_code": {
                "enum": [
                  "parse_timeout",
                  "memory_limit_exceeded",
                  "invalid_pdf",
                  "internal_error"
                ]
              },
              "error_message": { "type": "string", "minLength": 1 },
              "stdout": { "const": "empty" },
              "diagnostics": { "type": "boolean" },
              "worker_exit_code": { "type": "integer", "minimum": 1 },
              "worker_stderr": { "type": "string", "minLength": 1 }
            },
            "allOf": [
              {
                "if": {
                  "properties": { "diagnostics": { "const": true } },
                  "required": ["diagnostics"]
                },
                "then": {
                  "required": ["worker_exit_code", "worker_stderr"]
                }
              },
              {
                "if": {
                  "properties": { "diagnostics": { "const": false } },
                  "required": ["diagnostics"]
                },
                "then": {
                  "not": {
                    "anyOf": [
                      { "required": ["worker_exit_code"] },
                      { "required": ["worker_stderr"] }
                    ]
                  }
                }
              }
            ]
          }
        }
      }
    },
    "artifact_header_cases": {
      "type": "array",
      "minItems": 1,
      "items": {
        "type": "object",
        "required": [
          "name",
          "test_filter",
          "boundary",
          "expected_result"
        ],
        "additionalProperties": false,
        "properties": {
          "name": { "$ref": "#/$defs/case_name" },
          "test_filter": { "$ref": "#/$defs/rust_test_filter" },
          "boundary": { "const": "json_artifact_header_integrity" },
          "expected_result": { "enum": ["accepted", "rejected"] },
          "error_code": { "const": "internal_error" },
          "error_message": { "type": "string", "minLength": 1 }
        },
        "allOf": [
          {
            "if": {
              "properties": { "expected_result": { "const": "rejected" } },
              "required": ["expected_result"]
            },
            "then": {
              "required": ["error_code", "error_message"]
            }
          },
          {
            "if": {
              "properties": { "expected_result": { "const": "accepted" } },
              "required": ["expected_result"]
            },
            "then": {
              "not": {
                "anyOf": [
                  { "required": ["error_code"] },
                  { "required": ["error_message"] }
                ]
              }
            }
          }
        ]
      }
    },
    "pipe_limit_cases": {
      "type": "array",
      "minItems": 1,
      "items": {
        "type": "object",
        "required": [
          "name",
          "test_filter",
          "boundary",
          "expected_result"
        ],
        "additionalProperties": false,
        "properties": {
          "name": { "$ref": "#/$defs/case_name" },
          "test_filter": { "$ref": "#/$defs/rust_test_filter" },
          "boundary": { "const": "pipe_output_limit" },
          "expected_result": { "enum": ["accepted", "rejected"] },
          "error_code": { "const": "memory_limit_exceeded" },
          "error_message": { "const": "parse exceeded memory limit" }
        },
        "allOf": [
          {
            "if": {
              "properties": { "expected_result": { "const": "rejected" } },
              "required": ["expected_result"]
            },
            "then": {
              "required": ["error_code", "error_message"]
            }
          },
          {
            "if": {
              "properties": { "expected_result": { "const": "accepted" } },
              "required": ["expected_result"]
            },
            "then": {
              "not": {
                "anyOf": [
                  { "required": ["error_code"] },
                  { "required": ["error_message"] }
                ]
              }
            }
          }
        ]
      }
    },
    "error_envelope_cases": {
      "type": "array",
      "minItems": 1,
      "items": {
        "type": "object",
        "required": [
          "name",
          "test_filter",
          "boundary",
          "expected_result"
        ],
        "additionalProperties": false,
        "properties": {
          "name": { "$ref": "#/$defs/case_name" },
          "test_filter": { "$ref": "#/$defs/rust_test_filter" },
          "boundary": { "const": "stable_error_envelope_parser" },
          "expected_result": { "enum": ["accepted", "rejected"] },
          "error_code": { "$ref": "#/$defs/stable_worker_error_code" },
          "error_message": { "type": "string", "minLength": 1 },
          "rejection_reason": {
            "enum": [
              "invalid_json",
              "missing_code",
              "missing_message",
              "unknown_code",
              "non_string_message",
              "empty_message",
              "duplicate_error_field",
              "duplicate_code_field",
              "duplicate_message_field",
              "unexpected_error_field",
              "unexpected_top_level_field"
            ]
          }
        },
        "allOf": [
          {
            "if": {
              "properties": { "expected_result": { "const": "accepted" } },
              "required": ["expected_result"]
            },
            "then": {
              "required": ["error_code", "error_message"],
              "not": { "required": ["rejection_reason"] }
            }
          },
          {
            "if": {
              "properties": { "expected_result": { "const": "rejected" } },
              "required": ["expected_result"]
            },
            "then": {
              "required": ["rejection_reason"],
              "not": {
                "anyOf": [
                  { "required": ["error_code"] },
                  { "required": ["error_message"] }
                ]
              }
            }
          }
        ]
      }
    },
    "diagnostic_cases": {
      "type": "array",
      "minItems": 1,
      "items": {
        "type": "object",
        "required": [
          "name",
          "surface",
          "expected_diagnostics"
        ],
        "additionalProperties": false,
        "properties": {
          "name": { "$ref": "#/$defs/case_name" },
          "surface": {
            "enum": [
              "page_selection",
              "request_ref",
              "request_policy"
            ]
          },
          "expected_diagnostics": {
            "type": "array",
            "minItems": 1,
            "items": { "$ref": "#/$defs/diagnostic_message" },
            "uniqueItems": true
          }
        }
      }
    },
    "explicit_blockers": {
      "type": "array",
      "minItems": 1,
      "items": { "type": "string", "minLength": 1 },
      "uniqueItems": true
    }
  },
  "$defs": {
    "case_name": { "type": "string", "pattern": "^[a-z0-9]+(?:-[a-z0-9]+)*$" },
    "diagnostic_message": {
      "enum": [
        "request_ref is missing",
        "request_ref does not match sandbox subprocess request identity tuple",
        "request operation does not match command surface",
        "request diagnostics does not match inventory case",
        "request stderr policy does not match diagnostics mode",
        "request failure stdout policy is not empty",
        "request max_parse_ms does not match inventory case",
        "doc_parse request must bind explicit page selection",
        "fingerprint request must not carry page selection",
        "malformed page number",
        "pages are 1-based",
        "descending range in page selection",
        "page number out of range"
      ]
    },
    "repo_path": { "type": "string", "minLength": 1, "pattern": "^[A-Za-z0-9_./-]+$" },
    "rust_test_filter": { "type": "string", "pattern": "^[a-z0-9_]+$" },
    "stable_worker_error_code": {
      "enum": [
        "parse_timeout",
        "memory_limit_exceeded",
        "invalid_pdf",
        "internal_error"
      ]
    }
  }
}
