{
  "schema_version": 1,
  "contract": "sandbox_subprocess.v1",
  "status": "supported",
  "carrier": "pdfium worker process",
  "cases": [
    {
      "name": "doc-parse-timeout",
      "command_surface": "ethos doc parse",
      "request": "schemas/examples/sandbox-subprocess-doc-parse-timeout-request.example.json",
      "test_filter": "doc_parse_timeout_kills_pdfium_worker",
      "boundary": "max_parse_ms_timeout",
      "expected_failure": {
        "exit_code": 10,
        "error_code": "parse_timeout",
        "error_message": "parse exceeded max_parse_ms",
        "stdout": "empty",
        "diagnostics": false
      }
    },
    {
      "name": "fingerprint-timeout",
      "command_surface": "ethos fingerprint",
      "request": "schemas/examples/sandbox-subprocess-fingerprint-timeout-request.example.json",
      "test_filter": "pdf_fingerprint_timeout_kills_pdfium_worker",
      "boundary": "max_parse_ms_timeout",
      "expected_failure": {
        "exit_code": 10,
        "error_code": "parse_timeout",
        "error_message": "parse exceeded max_parse_ms",
        "stdout": "empty",
        "diagnostics": false
      }
    },
    {
      "name": "doc-parse-memory-limit",
      "command_surface": "ethos doc parse",
      "request": "schemas/examples/sandbox-subprocess-doc-parse-request.example.json",
      "test_filter": "doc_parse_memory_limit_worker_failure_is_stable",
      "boundary": "memory_limit_error",
      "expected_failure": {
        "exit_code": 11,
        "error_code": "memory_limit_exceeded",
        "error_message": "parse exceeded memory limit",
        "stdout": "empty",
        "diagnostics": false
      }
    },
    {
      "name": "doc-parse-stable-error-envelope",
      "command_surface": "ethos doc parse",
      "request": "schemas/examples/sandbox-subprocess-doc-parse-request.example.json",
      "test_filter": "doc_parse_relays_worker_stable_error_envelope",
      "boundary": "stable_error_envelope",
      "expected_failure": {
        "exit_code": 3,
        "error_code": "invalid_pdf",
        "error_message": "input does not contain a PDF header",
        "stdout": "empty",
        "diagnostics": false
      }
    },
    {
      "name": "doc-parse-stderr-hidden-by-default",
      "command_surface": "ethos doc parse",
      "request": "schemas/examples/sandbox-subprocess-doc-parse-request.example.json",
      "test_filter": "doc_parse_non_envelope_worker_failure_stays_canonical_without_diagnostics",
      "boundary": "diagnostics_gated_stderr",
      "expected_failure": {
        "exit_code": 12,
        "error_code": "internal_error",
        "error_message": "pdfium worker failed",
        "stdout": "empty",
        "diagnostics": false
      }
    },
    {
      "name": "doc-parse-diagnostics-gated-stderr",
      "command_surface": "ethos doc parse",
      "request": "schemas/examples/sandbox-subprocess-doc-parse-diagnostics-request.example.json",
      "test_filter": "doc_parse_non_envelope_worker_failure_includes_stderr_with_diagnostics",
      "boundary": "diagnostics_gated_stderr",
      "expected_failure": {
        "exit_code": 12,
        "error_code": "internal_error",
        "error_message": "pdfium worker failed",
        "stdout": "empty",
        "diagnostics": true,
        "worker_exit_code": 101,
        "worker_stderr": "native pdfium stderr sentinel\nsecond line"
      }
    }
  ],
  "artifact_header_cases": [
    {
      "name": "json-artifact-header-valid",
      "test_filter": "validates_json_artifact_header_against_file_hash",
      "boundary": "json_artifact_header_integrity",
      "expected_result": "accepted"
    },
    {
      "name": "json-artifact-header-invalid-json",
      "test_filter": "rejects_json_artifact_header_invalid_json",
      "boundary": "json_artifact_header_integrity",
      "expected_result": "rejected",
      "error_code": "internal_error",
      "error_message": "pdfium worker returned an invalid JSON artifact header"
    },
    {
      "name": "json-artifact-header-unsupported-schema",
      "test_filter": "rejects_json_artifact_header_unsupported_schema",
      "boundary": "json_artifact_header_integrity",
      "expected_result": "rejected",
      "error_code": "internal_error",
      "error_message": "pdfium worker returned an unsupported JSON artifact header"
    },
    {
      "name": "json-artifact-header-duplicate-field",
      "test_filter": "rejects_json_artifact_header_duplicate_field",
      "boundary": "json_artifact_header_integrity",
      "expected_result": "rejected",
      "error_code": "internal_error",
      "error_message": "pdfium worker returned an invalid JSON artifact header"
    },
    {
      "name": "json-artifact-header-unexpected-field",
      "test_filter": "rejects_json_artifact_header_unexpected_field",
      "boundary": "json_artifact_header_integrity",
      "expected_result": "rejected",
      "error_code": "internal_error",
      "error_message": "pdfium worker returned an invalid JSON artifact header"
    },
    {
      "name": "json-artifact-header-trailing-data",
      "test_filter": "rejects_json_artifact_header_trailing_data",
      "boundary": "json_artifact_header_integrity",
      "expected_result": "rejected",
      "error_code": "internal_error",
      "error_message": "pdfium worker returned an invalid JSON artifact header"
    },
    {
      "name": "json-artifact-header-missing-output-bytes",
      "test_filter": "rejects_json_artifact_header_missing_output_bytes",
      "boundary": "json_artifact_header_integrity",
      "expected_result": "rejected",
      "error_code": "internal_error",
      "error_message": "pdfium worker JSON artifact header missing output_bytes"
    },
    {
      "name": "json-artifact-header-missing-document-fingerprint",
      "test_filter": "rejects_json_artifact_header_missing_document_fingerprint",
      "boundary": "json_artifact_header_integrity",
      "expected_result": "rejected",
      "error_code": "internal_error",
      "error_message": "pdfium worker JSON artifact header missing document_fingerprint"
    },
    {
      "name": "json-artifact-header-missing-payload-sha256",
      "test_filter": "rejects_json_artifact_header_missing_payload_sha256",
      "boundary": "json_artifact_header_integrity",
      "expected_result": "rejected",
      "error_code": "internal_error",
      "error_message": "pdfium worker JSON artifact header missing payload_sha256"
    },
    {
      "name": "json-artifact-header-missing-output-sha256",
      "test_filter": "rejects_json_artifact_header_missing_output_sha256",
      "boundary": "json_artifact_header_integrity",
      "expected_result": "rejected",
      "error_code": "internal_error",
      "error_message": "pdfium worker JSON artifact header missing output_sha256"
    },
    {
      "name": "json-artifact-header-hash-mismatch",
      "test_filter": "rejects_json_artifact_header_hash_mismatch",
      "boundary": "json_artifact_header_integrity",
      "expected_result": "rejected",
      "error_code": "internal_error",
      "error_message": "pdfium worker JSON artifact hash mismatch"
    },
    {
      "name": "json-artifact-header-envelope-mismatch",
      "test_filter": "rejects_json_artifact_header_envelope_mismatch",
      "boundary": "json_artifact_header_integrity",
      "expected_result": "rejected",
      "error_code": "internal_error",
      "error_message": "pdfium worker JSON artifact header does not match artifact"
    }
  ],
  "pipe_limit_cases": [
    {
      "name": "worker-pipe-limit-empty-output",
      "test_filter": "worker_pipe_limit_accepts_empty_output",
      "boundary": "pipe_output_limit",
      "expected_result": "accepted"
    },
    {
      "name": "worker-pipe-limit-sized-output",
      "test_filter": "worker_pipe_limit_accepts_limit_sized_output",
      "boundary": "pipe_output_limit",
      "expected_result": "accepted"
    },
    {
      "name": "worker-pipe-limit-oversized-output",
      "test_filter": "worker_pipe_limit_rejects_oversized_output",
      "boundary": "pipe_output_limit",
      "expected_result": "rejected",
      "error_code": "memory_limit_exceeded",
      "error_message": "parse exceeded memory limit"
    },
    {
      "name": "worker-pipe-limit-preempts-timeout",
      "test_filter": "doc_parse_pipe_limit_worker_failure_preempts_timeout",
      "boundary": "pipe_output_limit",
      "expected_result": "rejected",
      "error_code": "memory_limit_exceeded",
      "error_message": "parse exceeded memory limit"
    }
  ],
  "error_envelope_cases": [
    {
      "name": "worker-error-envelope-stable-error",
      "test_filter": "worker_error_envelope_parses_stable_error",
      "boundary": "stable_error_envelope_parser",
      "expected_result": "accepted",
      "error_code": "invalid_pdf",
      "error_message": "input does not contain a PDF header"
    },
    {
      "name": "worker-error-envelope-diagnostics-metadata",
      "test_filter": "worker_error_envelope_allows_diagnostics_metadata",
      "boundary": "stable_error_envelope_parser",
      "expected_result": "accepted",
      "error_code": "invalid_pdf",
      "error_message": "input does not contain a PDF header"
    },
    {
      "name": "worker-error-envelope-invalid-json",
      "test_filter": "worker_error_envelope_rejects_invalid_json",
      "boundary": "stable_error_envelope_parser",
      "expected_result": "rejected",
      "rejection_reason": "invalid_json"
    },
    {
      "name": "worker-error-envelope-missing-code",
      "test_filter": "worker_error_envelope_rejects_missing_code",
      "boundary": "stable_error_envelope_parser",
      "expected_result": "rejected",
      "rejection_reason": "missing_code"
    },
    {
      "name": "worker-error-envelope-missing-message",
      "test_filter": "worker_error_envelope_rejects_missing_message",
      "boundary": "stable_error_envelope_parser",
      "expected_result": "rejected",